### ISSUE TITLE
自定义域名列表需要PSN用户的贡献

### ISSUE THREAD

**Issue by Paull** [Paull/hiwifi.easucks#1]
手头只有Xbox One，已填好xbox相关域名和ea相关域名，使用gfwlist模式时会既可以享受SS的稳定，又可以避免测速、下载等高流量应用走SS。
xbox live和ea强制走SS域名列表如下：
```
microsoft.com
windows.net
XBOXLIVE.COM
xboxlive.com
xbox.com
live.com
ea.com
easports.com
origin.com
```
xbox live下载和测试强制不走SS域名列表如下：
```
xbox.ipv6.microsoft.com
notice.xbox.com
speedtest.xboxlive.com
networktest.xboxlive.com
assets1.xboxlive.com
assets2.xboxlive.com
dlassets.xboxlive.com
dlassets2.xboxlive.com
screenshotsmetadata.xboxlive.com
```

如有不完整，欢迎补充。

另附上极路由root后的测试方法：
安装tcpdump
```
opkg update
opkg install tcpdump
```
域名收集指令（请替换其中的192.168.199.xxx为PS4主机的IP）：
```
tcpdump -i br-lan udp and src host 192.168.199.xxx and dst port 53
```

**Comment by genics** [comment]
明天送上~

**Comment by genics** [comment]
微信K-Paxart  送上~

08:47:03.204251 IP PS4.lan.57110 > LEDE-X64.lan.53: 2670+ A? easportsassets-a.akamaihd.net. (47)
08:47:06.531893 IP PS4.lan.63134 > LEDE-X64.lan.53: 64526+ A? nsx.np.dl.playstation.net. (43)
08:47:19.866926 IP PS4.lan.55458 > LEDE-X64.lan.53: 63854+ A? river-tls2.data.ea.com. (40)
08:47:48.053320 IP PS4.lan.57049 > LEDE-X64.lan.53: 53071+ A? hk-prof.np.community.playstation.net. (54)
08:47:54.865342 IP PS4.lan.59055 > LEDE-X64.lan.53: 64258+ A? pin-river.data.ea.com. (39)
08:48:04.886015 IP PS4.lan.49479 > LEDE-X64.lan.53: 38647+ A? river-tls2.data.ea.com. (40)
08:48:26.922191 IP PS4.lan.63106 > LEDE-X64.lan.53: 14128+ A? event.api.np.km.playstation.net. (49)
08:48:28.151158 IP PS4.lan.53033 > LEDE-X64.lan.53: 33394+ A? ps4updptl.jp.np.community.playstation.net. (59)
08:48:31.005457 IP PS4.lan.53226 > LEDE-X64.lan.53: 43846+ A? ps4.updptl.np.community.playstation.net. (57)
08:49:02.722562 IP PS4.lan.58965 > LEDE-X64.lan.53: 63985+ A? hk-prof.np.community.playstation.net. (54)
08:50:06.196022 IP PS4.lan.50975 > LEDE-X64.lan.53: 48483+ A? nsx.np.dl.playstation.net. (43)
08:50:16.623466 IP PS4.lan.60737 > LEDE-X64.lan.53: 28528+ A? hk-prof.np.community.playstation.net. (54)
08:51:30.821010 IP PS4.lan.58223 > LEDE-X64.lan.53: 64905+ A? hk-prof.np.community.playstation.net. (54)
08:51:34.988788 IP PS4.lan.65203 > LEDE-X64.lan.53: 46455+ A? nsx.np.dl.playstation.net. (43)
08:52:45.524329 IP PS4.lan.61619 > LEDE-X64.lan.53: 24303+ A? hk-prof.np.community.playstation.net. (54)
08:53:58.769276 IP PS4.lan.50321 > LEDE-X64.lan.53: 56488+ A? hk-prof.np.community.playstation.net. (54)
08:55:11.340498 IP PS4.lan.56963 > LEDE-X64.lan.53: 1653+ A? hk-prof.np.community.playstation.net. (54)
08:56:23.790651 IP PS4.lan.57129 > LEDE-X64.lan.53: 51340+ A? hk-prof.np.community.playstation.net. (54)
08:57:36.523222 IP PS4.lan.57062 > LEDE-X64.lan.53: 60294+ A? hk-prof.np.community.playstation.net. (54)
08:58:50.176559 IP PS4.lan.64612 > LEDE-X64.lan.53: 42891+ A? hk-prof.np.community.playstation.net. (54)
09:00:05.040865 IP PS4.lan.58962 > LEDE-X64.lan.53: 31036+ A? hk-prof.np.community.playstation.net. (54)
09:01:18.893024 IP PS4.lan.59026 > LEDE-X64.lan.53: 35088+ A? hk-prof.np.community.playstation.net. (54)
09:02:31.778016 IP PS4.lan.53895 > LEDE-X64.lan.53: 15936+ A? hk-prof.np.community.playstation.net. (54)
09:03:44.112761 IP PS4.lan.62100 > LEDE-X64.lan.53: 2370+ A? hk-prof.np.community.playstation.net. (54)
09:04:56.610477 IP PS4.lan.56871 > LEDE-X64.lan.53: 12004+ A? hk-prof.np.community.playstation.net. (54)
09:06:12.848959 IP PS4.lan.56641 > LEDE-X64.lan.53: 44836+ A? hk-prof.np.community.playstation.net. (54)
09:07:27.214089 IP PS4.lan.60658 > LEDE-X64.lan.53: 21589+ A? hk-prof.np.community.playstation.net. (54)
09:08:41.664370 IP PS4.lan.65234 > LEDE-X64.lan.53: 44148+ A? hk-prof.np.community.playstation.net. (54)
09:09:54.580364 IP PS4.lan.63460 > LEDE-X64.lan.53: 5215+ A? hk-prof.np.community.playstation.net. (54)
09:11:07.015803 IP PS4.lan.53977 > LEDE-X64.lan.53: 20484+ A? hk-prof.np.community.playstation.net. (54)
09:12:19.616696 IP PS4.lan.61871 > LEDE-X64.lan.53: 10172+ A? hk-prof.np.community.playstation.net. (54)
09:13:32.580473 IP PS4.lan.57461 > LEDE-X64.lan.53: 62334+ A? hk-prof.np.community.playstation.net. (54)
09:14:46.713428 IP PS4.lan.60600 > LEDE-X64.lan.53: 51673+ A? hk-prof.np.community.playstation.net. (54)
09:16:01.463791 IP PS4.lan.52389 > LEDE-X64.lan.53: 3853+ A? hk-prof.np.community.playstation.net. (54)
09:17:14.751151 IP PS4.lan.55882 > LEDE-X64.lan.53: 19594+ A? hk-prof.np.community.playstation.net. (54)
09:18:27.269171 IP PS4.lan.64908 > LEDE-X64.lan.53: 2508+ A? hk-prof.np.community.playstation.net. (54)
09:19:39.815507 IP PS4.lan.57949 > LEDE-X64.lan.53: 38748+ A? hk-prof.np.community.playstation.net. (54)
09:20:52.585925 IP PS4.lan.49477 > LEDE-X64.lan.53: 8023+ A? hk-prof.np.community.playstation.net. (54)
09:22:06.454038 IP PS4.lan.50040 > LEDE-X64.lan.53: 49064+ A? hk-prof.np.community.playstation.net. (54)
09:23:18.088624 IP PS4.lan.62747 > LEDE-X64.lan.53: 7896+ A? hk-prof.np.community.playstation.net. (54)
09:24:37.637642 IP PS4.lan.63740 > LEDE-X64.lan.53: 27884+ A? hk-prof.np.community.playstation.net. (54)
09:25:50.259591 IP PS4.lan.58062 > LEDE-X64.lan.53: 32286+ A? hk-prof.np.community.playstation.net. (54)
09:27:02.571529 IP PS4.lan.53305 > LEDE-X64.lan.53: 54273+ A? hk-prof.np.community.playstation.net. (54)
09:28:15.343452 IP PS4.lan.56410 > LEDE-X64.lan.53: 61101+ A? hk-prof.np.community.playstation.net. (54)
09:29:28.741748 IP PS4.lan.55569 > LEDE-X64.lan.53: 49476+ A? hk-prof.np.community.playstation.net. (54)
09:30:43.223915 IP PS4.lan.59590 > LEDE-X64.lan.53: 50001+ A? hk-prof.np.community.playstation.net. (54)
09:31:57.711655 IP PS4.lan.59295 > LEDE-X64.lan.53: 40237+ A? hk-prof.np.community.playstation.net. (54)
09:33:10.525448 IP PS4.lan.61424 > LEDE-X64.lan.53: 8909+ A? hk-prof.np.community.playstation.net. (54)
09:34:23.009436 IP PS4.lan.63174 > LEDE-X64.lan.53: 20016+ A? hk-prof.np.community.playstation.net. (54)
09:35:35.611221 IP PS4.lan.51862 > LEDE-X64.lan.53: 18556+ A? hk-prof.np.community.playstation.net. (54)
09:36:48.609989 IP PS4.lan.63102 > LEDE-X64.lan.53: 3369+ A? hk-prof.np.community.playstation.net. (54)
09:38:02.765144 IP PS4.lan.61156 > LEDE-X64.lan.53: 27562+ A? hk-prof.np.community.playstation.net. (54)
09:39:17.430930 IP PS4.lan.57118 > LEDE-X64.lan.53: 17885+ A? hk-prof.np.community.playstation.net. (54)
09:40:30.980464 IP PS4.lan.58136 > LEDE-X64.lan.53: 61178+ A? hk-prof.np.community.playstation.net. (54)
09:41:37.881279 IP PS4.lan.51962 > LEDE-X64.lan.53: 14987+ A? hk-prof.np.community.playstation.net. (54)
09:42:56.013931 IP PS4.lan.50367 > LEDE-X64.lan.53: 54893+ A? hk-prof.np.community.playstation.net. (54)
 09:43:15.827828 IP PS4.lan.63199 > LEDE-X64.lan.53: 8387+ A? accounts.ea.com. (33)
09:43:36.694841 IP PS4.lan.56439 > LEDE-X64.lan.53: 6768+ A? hk-prof.np.community.playstation.net. (54)
09:43:37.799693 IP PS4.lan.60814 > LEDE-X64.lan.53: 16472+ A? theia.dl.playstation.net. (42)
09:43:37.846885 IP PS4.lan.64163 > LEDE-X64.lan.53: 18391+ A? asm.np.community.playstation.net. (50)
09:43:38.486719 IP PS4.lan.64753 > LEDE-X64.lan.53: 12252+ A? hk-prof.np.community.playstation.net. (54)
09:43:38.725568 IP PS4.lan.65517 > LEDE-X64.lan.53: 63688+ A? image.api.np.km.playstation.net. (49)
09:43:39.450802 IP PS4.lan.58383 > LEDE-X64.lan.53: 36672+ A? commerce1.api.np.km.playstation.net. (53)
09:43:39.724954 IP PS4.lan.59669 > LEDE-X64.lan.53: 27382+ A? commerce.api.np.km.playstation.net. (52)
09:43:39.757238 IP PS4.lan.61345 > LEDE-X64.lan.53: 61339+ A? communities.api.playstation.com. (49)
09:43:39.757297 IP PS4.lan.55363 > LEDE-X64.lan.53: 51098+ A? livearea.api.np.km.playstation.net. (52)
09:43:41.185526 IP PS4.lan.52964 > LEDE-X64.lan.53: 25453+ A? catalog.api.np.km.playstation.net. (51)
09:43:41.259570 IP PS4.lan.54338 > LEDE-X64.lan.53: 5812+ A? activity.api.np.km.playstation.net. (52)
09:43:41.259627 IP PS4.lan.60775 > LEDE-X64.lan.53: 42088+ A? activity.api.np.km.playstation.net. (52)
09:43:43.438674 IP PS4.lan.58162 > LEDE-X64.lan.53: 54961+ A? hk-evnt-edge.np.community.playstation.net. (59)
09:43:43.471657 IP PS4.lan.65526 > LEDE-X64.lan.53: 33608+ A? hk-prof.np.community.playstation.net. (54)
09:43:45.506758 IP PS4.lan.49701 > LEDE-X64.lan.53: 25395+ A? hk-tpy.np.community.playstation.net. (53)
09:43:51.799375 IP PS4.lan.55416 > LEDE-X64.lan.53: 20846+ A? static-resource.np.community.playstation.net. (62)
09:43:51.804715 IP PS4.lan.58285 > LEDE-X64.lan.53: 23214+ A? psn-rsc.prod.dl.playstation.net. (49)
09:43:51.906518 IP PS4.lan.59120 > LEDE-X64.lan.53: 5795+ A? trophy01.np.community.playstation.net. (55)
09:43:51.986028 IP PS4.lan.49481 > LEDE-X64.lan.53: 3654+ A? satchel-cdn.api.playstation.com. (49)
09:43:52.171641 IP PS4.lan.52363 > LEDE-X64.lan.53: 42434+ A? event.api.np.km.playstation.net. (49)
09:44:09.079904 IP PS4.lan.62450 > LEDE-X64.lan.53: 44845+ A? hk-prof.np.community.playstation.net. (54)
09:44:26.266008 IP PS4.lan.60683 > LEDE-X64.lan.53: 31168+ A? utas.external.ps4.s2.fut.ea.com. (49)
09:44:26.279322 IP PS4.lan.56633 > LEDE-X64.lan.53: 56078+ A? pin-river.data.ea.com. (39)
09:44:26.346221 IP PS4.lan.57317 > LEDE-X64.lan.53: 62446+ A? river-tls2.data.ea.com. (40)
09:44:26.618746 IP PS4.lan.61187 > LEDE-X64.lan.53: 58655+ A? pas.external.s2.easfc.ea.com. (46)
09:44:26.787329 IP PS4.lan.61769 > LEDE-X64.lan.53: 65054+ A? trophy01.np.community.playstation.net. (55)
09:44:26.976673 IP PS4.lan.50034 > LEDE-X64.lan.53: 788+ A? fifa17.content.easports.com. (45)
09:44:27.726068 IP PS4.lan.60182 > LEDE-X64.lan.53: 32228+ A? auth.api.np.ac.playstation.net. (48)
09:44:36.363839 IP PS4.lan.52304 > LEDE-X64.lan.53: 9648+ A? hk-prof.np.community.playstation.net. (54)
09:44:37.515965 IP PS4.lan.53223 > LEDE-X64.lan.53: 226+ A? image.api.np.km.playstation.net. (49)
09:44:44.180480 IP PS4.lan.57688 > LEDE-X64.lan.53: 16897+ A? us.np.stun.playstation.net. (44)
09:44:44.183087 IP PS4.lan.62992 > LEDE-X64.lan.53: 26170+ A? fcn01.ps4.update.playstation.net. (50)
09:44:44.187001 IP PS4.lan.57670 > LEDE-X64.lan.53: 41147+ A? gs-sec.ww.np.dl.playstation.net. (49)
09:44:44.196862 IP PS4.lan.56860 > LEDE-X64.lan.53: 6385+ A? fcn01.ps4.update.playstation.net. (50)
09:44:44.207044 IP PS4.lan.61937 > LEDE-X64.lan.53: 53540+ A? hk-prof.np.community.playstation.net. (54)
09:44:44.210180 IP PS4.lan.64805 > LEDE-X64.lan.53: 45907+ A? gs-sec.ww.np.dl.playstation.net. (49)
09:44:44.542294 IP PS4.lan.62607 > LEDE-X64.lan.53: 37396+ A? hk-prof.np.community.playstation.net. (54)
09:44:44.988345 IP PS4.lan.65267 > LEDE-X64.lan.53: 45918+ A? theia.dl.playstation.net. (42)
09:44:45.406415 IP PS4.lan.62324 > LEDE-X64.lan.53: 57479+ A? auth.api.np.ac.playstation.net. (48)
09:44:46.178806 IP PS4.lan.57530 > LEDE-X64.lan.53: 41652+ A? hk-push.np.communication.playstation.net. (58)
09:44:46.516526 IP PS4.lan.49480 > LEDE-X64.lan.53: 32490+ A? commerce1.api.np.km.playstation.net. (53)
09:44:46.516604 IP PS4.lan.61094 > LEDE-X64.lan.53: 50845+ A? livearea.api.np.km.playstation.net. (52)
09:44:46.521822 IP PS4.lan.53620 > LEDE-X64.lan.53: 61451+ A? communities.api.playstation.com. (49)
09:44:46.521872 IP PS4.lan.54432 > LEDE-X64.lan.53: 43622+ A? hk-evnt-edge.np.community.playstation.net. (59)
09:44:46.576490 IP PS4.lan.64343 > LEDE-X64.lan.53: 40578+ A? hk-prof.np.community.playstation.net. (54)
09:44:46.592665 IP PS4.lan.54894 > LEDE-X64.lan.53: 50725+ A? hk-tpy.np.community.playstation.net. (53)
09:44:47.415198 IP PS4.lan.58449 > LEDE-X64.lan.53: 56497+ A? vl.api.np.km.playstation.net. (46)
09:44:47.465676 IP PS4.lan.64913 > LEDE-X64.lan.53: 58088+ A? commerce.api.np.km.playstation.net. (52)
09:44:47.985107 IP PS4.lan.57974 > LEDE-X64.lan.53: 31633+ A? activity.api.np.km.playstation.net. (52)
09:44:48.477223 IP PS4.lan.55171 > LEDE-X64.lan.53: 1761+ A? 52-32-178-115-push.np.communication.playstation.net. (69)
09:44:48.782126 IP PS4.lan.59843 > LEDE-X64.lan.53: 63847+ A? gs2.ww.prod.dl.playstation.net. (48)
09:44:48.782205 IP PS4.lan.55920 > LEDE-X64.lan.53: 4932+ A? gs2.ww.prod.dl.playstation.net. (48)
09:44:48.782229 IP PS4.lan.56931 > LEDE-X64.lan.53: 38047+ A? gs2.ww.prod.dl.playstation.net. (48)
09:44:48.793104 IP PS4.lan.61973 > LEDE-X64.lan.53: 39827+ A? catalog.api.np.km.playstation.net. (51)
09:44:49.665915 IP PS4.lan.64349 > LEDE-X64.lan.53: 54300+ A? post.net.playstation.net. (42)
09:44:51.036311 IP PS4.lan.51442 > LEDE-X64.lan.53: 18958+ A? satchel-cdn.api.playstation.com. (49)
09:44:51.149725 IP PS4.lan.58618 > LEDE-X64.lan.53: 26975+ A? event.api.np.km.playstation.net. (49)
09:45:10.327125 IP PS4.lan.62462 > LEDE-X64.lan.53: 30715+ A? gs-sec.ww.np.dl.playstation.net. (49)
09:45:11.314407 IP PS4.lan.50615 > LEDE-X64.lan.53: 58078+ A? tmdb.np.dl.playstation.net. (44)
09:45:11.780111 IP PS4.lan.63256 > LEDE-X64.lan.53: 21209+ A? auth.api.np.ac.playstation.net. (48)
09:45:14.563223 IP PS4.lan.62107 > LEDE-X64.lan.53: 42325+ A? winter15.gosredirector.ea.com. (47)
09:45:16.361978 IP PS4.lan.60324 > LEDE-X64.lan.53: 12582+ A? gosprapp1762.ea.com. (37)
09:45:18.479699 IP PS4.lan.61908 > LEDE-X64.lan.53: 25680+ A? qos-prod-bio-dub-common-common.gos.ea.com. (59)
09:45:18.479974 IP PS4.lan.57175 > LEDE-X64.lan.53: 2647+ A? qos-prod-bio-iad-common-common.gos.ea.com. (59)
09:45:18.480119 IP PS4.lan.64449 > LEDE-X64.lan.53: 30638+ A? qos-prod-bio-sjc-common-common.gos.ea.com. (59)
09:45:18.480306 IP PS4.lan.62897 > LEDE-X64.lan.53: 12984+ A? qos-prod-bio-syd-common-common.gos.ea.com. (59)
09:45:18.480449 IP PS4.lan.52933 > LEDE-X64.lan.53: 33862+ A? qos-prod-i3d-dxb-common-common.gos.ea.com. (59)
09:45:18.480629 IP PS4.lan.55985 > LEDE-X64.lan.53: 58641+ A? qos-prod-m3d-brz-common-common.gos.ea.com. (59)
09:45:18.480819 IP PS4.lan.55327 > LEDE-X64.lan.53: 35690+ A? qos-prod-m3d-nrt-common-common.gos.ea.com. (59)
09:45:20.911790 IP PS4.lan.56100 > LEDE-X64.lan.53: 7592+ A? accounts.ea.com. (33)
09:45:27.604805 IP PS4.lan.53628 > LEDE-X64.lan.53: 64889+ A? fifa17.service.easports.com. (45)
09:45:27.608502 IP PS4.lan.54361 > LEDE-X64.lan.53: 64046+ A? pin-river.data.ea.com. (39)
09:45:27.609069 IP PS4.lan.56280 > LEDE-X64.lan.53: 36125+ A? river-tls2.data.ea.com. (40)
09:45:29.084371 IP PS4.lan.60006 > LEDE-X64.lan.53: 33472+ A? hk-prof.np.community.playstation.net. (54)
09:45:31.281560 IP PS4.lan.57036 > LEDE-X64.lan.53: 2167+ A? fifa17.content.easports.com. (45)
09:45:32.479164 IP PS4.lan.57847 > LEDE-X64.lan.53: 56826+ A? pas.external.s2.easfc.ea.com. (46)
09:45:39.161628 IP PS4.lan.56700 > LEDE-X64.lan.53: 26271+ A? utas.external.ps4.s2.fut.ea.com. (49)
09:46:12.630919 IP PS4.lan.64700 > LEDE-X64.lan.53: 6889+ A? river-tls2.data.ea.com. (40)

**Comment by Paull** [comment]
```
awk '{print $8}' ps4.txt |sort|uniq|grep -v ea.com|grep -v easports.com|grep -v akamaihd.net
```
肉眼过滤后确定ps4只有两个根域名
- playstation.net
- playstation.com
另确定一个可疑域名为NAT等级测试，需加入强制不走SS列表（虽然测试是UDP的，但以防以后SS选择性支持了UDP转了）  
```
us.np.stun.playstation.net
```
但是目前尚不确定带有下载的域名具体是哪个或哪些，可疑域名如下
```
theia.dl.playstation.net  
nsx.np.dl.playstation.net 
tmdb.np.dl.playstation.net
us.np.stun.playstation.net
gs2.ww.prod.dl.playstation.net
psn-rsc.prod.dl.playstation.net
gs-sec.ww.np.dl.playstation.net
fcn01.ps4.update.playstation.net
ps4.updptl.np.community.playstation.net
ps4updptl.jp.np.community.playstation.net
```

**Comment by Paull** [comment]
@genics 我记得你有iftop？
可以再进一步测试一下下载服务器是哪个域名么
测试方法如下
在dnsmasq的配置文件中加入log-queries这句（弄完记得删除），然后重启dnsmasq
然后两个ssh窗口，一个运行tail -f /var/log/syslog，另一个运行iftop
通过iftop找到大流量的IP并在dnsmasq的log中找到该IP的域名（要CNAME之前的，CNAME一般都是具体的CDN服务器）

**Comment by genics** [comment]
收到,等下就测试

**Comment by genics** [comment]
p大,第一步是让ssh显示系统的log对吧? openwrt里面没这个log文件,我得另外想办法,是不是只需要把log文件输出出来查看就行?
第二步iftop是在ps4下载过程中,找到大流量的ip? 最后对应ip在第一步的log文件里找到对应的域名,不知道我理解对不?

**Comment by Paull** [comment]
对

genics <notifications@github.com>于2016年12月29日周四 11:44写道：

**Comment by genics** [comment]
p大,应该是这个 reply a1796.w58.w.cucdn.cn is 42.236.72.169

**Comment by genics** [comment]
前后的信息.估计是这行前面的那些
Thu Dec 29 11:57:13 2016 daemon.info dnsmasq[11908]: reply vip1.images.client.sandai.net is 119.188.108.240
Thu Dec 29 11:57:13 2016 daemon.info dnsmasq[11908]: reply vip1.images.client.sandai.net is 182.118.18.100
Thu Dec 29 11:57:16 2016 daemon.info dnsmasq[11908]: query[A] gs-sec.ww.np.dl.playstation.net from 192.168.1.13
Thu Dec 29 11:57:16 2016 daemon.info dnsmasq[11908]: forwarded gs-sec.ww.np.dl.playstation.net to 119.29.29.29
Thu Dec 29 11:57:16 2016 daemon.info dnsmasq[11908]: forwarded gs-sec.ww.np.dl.playstation.net to 223.5.5.5
Thu Dec 29 11:57:16 2016 daemon.info dnsmasq[11908]: reply gs-sec.ww.np.dl.playstation.net is <CNAME>
Thu Dec 29 11:57:16 2016 daemon.info dnsmasq[11908]: reply wild.ww.np.dl.playstation.net.edgekey.net is <CNAME>
Thu Dec 29 11:57:16 2016 daemon.info dnsmasq[11908]: reply e3803.d.akamaiedge.net is 96.7.104.78
Thu Dec 29 11:57:16 2016 daemon.info dnsmasq[11908]: query[A] image.api.np.km.playstation.net from 192.168.1.13
Thu Dec 29 11:57:16 2016 daemon.info dnsmasq[11908]: forwarded image.api.np.km.playstation.net to 119.29.29.29
Thu Dec 29 11:57:16 2016 daemon.info dnsmasq[11908]: forwarded image.api.np.km.playstation.net to 223.5.5.5
Thu Dec 29 11:57:16 2016 daemon.info dnsmasq[11908]: reply image.api.np.km.playstation.net is <CNAME>
Thu Dec 29 11:57:16 2016 daemon.info dnsmasq[11908]: reply wild.api.np.km.playstation.net.edgekey.net is <CNAME>
Thu Dec 29 11:57:16 2016 daemon.info dnsmasq[11908]: reply e8357.g.akamaiedge.net is 23.194.239.174
Thu Dec 29 11:57:16 2016 daemon.info dnsmasq[11908]: query[A] gs2.ww.prod.dl.playstation.net from 192.168.1.13
Thu Dec 29 11:57:16 2016 daemon.info dnsmasq[11908]: forwarded gs2.ww.prod.dl.playstation.net to 119.29.29.29
Thu Dec 29 11:57:16 2016 daemon.info dnsmasq[11908]: forwarded gs2.ww.prod.dl.playstation.net to 223.5.5.5
Thu Dec 29 11:57:16 2016 daemon.info dnsmasq[11908]: reply gs2.ww.prod.dl.playstation.net is <CNAME>
Thu Dec 29 11:57:16 2016 daemon.info dnsmasq[11908]: reply gs2-ww-prod.psn.akadns.net is <CNAME>
Thu Dec 29 11:57:16 2016 daemon.info dnsmasq[11908]: reply china.gs2.ww.prod.dl.playstation.net.edgesuite.net is <CNAME>
Thu Dec 29 11:57:16 2016 daemon.info dnsmasq[11908]: reply china.gs2.ww.prod.dl.playstation.net.edgesuite.net.globalredir.akadns.net is <CNAME>
Thu Dec 29 11:57:16 2016 daemon.info dnsmasq[11908]: reply a1796.w58.w.cucdn.cn is 42.236.72.169

**Comment by genics** [comment]
通过域名我好像已经找到了答案,这两篇文章
http://www.besteric.com/2015/01/21/my-ps4-network/

https://myps4.eu.org/archives/87.html
